{
  "schemaVersion": 1,
  "type": "landmark.chunk",
  "streamId": "11111111-1111-4111-8111-111111111111",
  "sequence": 0,
  "frames": [
    {
      "sequence": 0,
      "timestampMs": 0,
      "features": [-0.45,0.2,-0.02,1,-0.435,0.22,-0.02,1,-0.42,0.24,-0.02,1,-0.405,0.26,-0.02,1,-0.39,0.28,-0.02,1,-0.375,0.3,-0.02,1,-0.36,0.32,-0.02,1,-0.345,0.34,-0.02,1,-0.33,0.36,-0.02,1,-0.315,0.38,-0.02,1,-0.3,0.4,-0.02,1,-0.285,0.42,-0.02,1,-0.27,0.44,-0.02,1,-0.255,0.46,-0.02,1,-0.24,0.48,-0.02,1,-0.225,0.5,-0.02,1,-0.21,0.52,-0.02,1,-0.195,0.54,-0.02,1,-0.18,0.56,-0.02,1,-0.165,0.58,-0.02,1,-0.15,0.6,-0.02,1,0.45,0.2,-0.02,1,0.435,0.22,-0.02,1,0.42,0.24,-0.02,1,0.405,0.26,-0.02,1,0.39,0.28,-0.02,1,0.375,0.3,-0.02,1,0.36,0.32,-0.02,1,0.345,0.34,-0.02,1,0.33,0.36,-0.02,1,0.315,0.38,-0.02,1,0.3,0.4,-0.02,1,0.285,0.42,-0.02,1,0.27,0.44,-0.02,1,0.255,0.46,-0.02,1,0.24,0.48,-0.02,1,0.225,0.5,-0.02,1,0.21,0.52,-0.02,1,0.195,0.54,-0.02,1,0.18,0.56,-0.02,1,0.165,0.58,-0.02,1,0.15,0.6,-0.02,1,-0.5,0,0,1,0.5,0,0,1,-0.7,0.45,0,1,0.7,0.45,0,1,-0.8,0.9,0,1,0.8,0.9,0,1,-0.85,0.95,0,1,0.85,0.95,0,1,-0.78,0.92,0,1,0.78,0.92,0,1,-0.75,0.88,0,1,0.75,0.88,0,1,-0.4,1.4,0,1,0.4,1.4,0,1]
    },
    {
      "sequence": 1,
      "timestampMs": 40,
      "features": [-0.45,0.2,-0.02,1,-0.435,0.22,-0.02,1,-0.42,0.24,-0.02,1,-0.405,0.26,-0.02,1,-0.39,0.28,-0.02,1,-0.375,0.3,-0.02,1,-0.36,0.32,-0.02,1,-0.345,0.34,-0.02,1,-0.33,0.36,-0.02,1,-0.315,0.38,-0.02,1,-0.3,0.4,-0.02,1,-0.285,0.42,-0.02,1,-0.27,0.44,-0.02,1,-0.255,0.46,-0.02,1,-0.24,0.48,-0.02,1,-0.225,0.5,-0.02,1,-0.21,0.52,-0.02,1,-0.195,0.54,-0.02,1,-0.18,0.56,-0.02,1,-0.165,0.58,-0.02,1,-0.15,0.6,-0.02,1,0.45,0.2,-0.02,1,0.435,0.22,-0.02,1,0.42,0.24,-0.02,1,0.405,0.26,-0.02,1,0.39,0.28,-0.02,1,0.375,0.3,-0.02,1,0.36,0.32,-0.02,1,0.345,0.34,-0.02,1,0.33,0.36,-0.02,1,0.315,0.38,-0.02,1,0.3,0.4,-0.02,1,0.285,0.42,-0.02,1,0.27,0.44,-0.02,1,0.255,0.46,-0.02,1,0.24,0.48,-0.02,1,0.225,0.5,-0.02,1,0.21,0.52,-0.02,1,0.195,0.54,-0.02,1,0.18,0.56,-0.02,1,0.165,0.58,-0.02,1,0.15,0.6,-0.02,1,-0.5,0,0,1,0.5,0,0,1,-0.7,0.45,0,1,0.7,0.45,0,1,-0.8,0.9,0,1,0.8,0.9,0,1,-0.85,0.95,0,1,0.85,0.95,0,1,-0.78,0.92,0,1,0.78,0.92,0,1,-0.75,0.88,0,1,0.75,0.88,0,1,-0.4,1.4,0,1,0.4,1.4,0,1]
    },
    {
      "sequence": 2,
      "timestampMs": 80,
      "features": [-0.45,0.2,-0.02,1,-0.435,0.22,-0.02,1,-0.42,0.24,-0.02,1,-0.405,0.26,-0.02,1,-0.39,0.28,-0.02,1,-0.375,0.3,-0.02,1,-0.36,0.32,-0.02,1,-0.345,0.34,-0.02,1,-0.33,0.36,-0.02,1,-0.315,0.38,-0.02,1,-0.3,0.4,-0.02,1,-0.285,0.42,-0.02,1,-0.27,0.44,-0.02,1,-0.255,0.46,-0.02,1,-0.24,0.48,-0.02,1,-0.225,0.5,-0.02,1,-0.21,0.52,-0.02,1,-0.195,0.54,-0.02,1,-0.18,0.56,-0.02,1,-0.165,0.58,-0.02,1,-0.15,0.6,-0.02,1,0.45,0.2,-0.02,1,0.435,0.22,-0.02,1,0.42,0.24,-0.02,1,0.405,0.26,-0.02,1,0.39,0.28,-0.02,1,0.375,0.3,-0.02,1,0.36,0.32,-0.02,1,0.345,0.34,-0.02,1,0.33,0.36,-0.02,1,0.315,0.38,-0.02,1,0.3,0.4,-0.02,1,0.285,0.42,-0.02,1,0.27,0.44,-0.02,1,0.255,0.46,-0.02,1,0.24,0.48,-0.02,1,0.225,0.5,-0.02,1,0.21,0.52,-0.02,1,0.195,0.54,-0.02,1,0.18,0.56,-0.02,1,0.165,0.58,-0.02,1,0.15,0.6,-0.02,1,-0.5,0,0,1,0.5,0,0,1,-0.7,0.45,0,1,0.7,0.45,0,1,-0.8,0.9,0,1,0.8,0.9,0,1,-0.85,0.95,0,1,0.85,0.95,0,1,-0.78,0.92,0,1,0.78,0.92,0,1,-0.75,0.88,0,1,0.75,0.88,0,1,-0.4,1.4,0,1,0.4,1.4,0,1]
    },
    {
      "sequence": 3,
      "timestampMs": 120,
      "features": [-0.45,0.2,-0.02,1,-0.435,0.22,-0.02,1,-0.42,0.24,-0.02,1,-0.405,0.26,-0.02,1,-0.39,0.28,-0.02,1,-0.375,0.3,-0.02,1,-0.36,0.32,-0.02,1,-0.345,0.34,-0.02,1,-0.33,0.36,-0.02,1,-0.315,0.38,-0.02,1,-0.3,0.4,-0.02,1,-0.285,0.42,-0.02,1,-0.27,0.44,-0.02,1,-0.255,0.46,-0.02,1,-0.24,0.48,-0.02,1,-0.225,0.5,-0.02,1,-0.21,0.52,-0.02,1,-0.195,0.54,-0.02,1,-0.18,0.56,-0.02,1,-0.165,0.58,-0.02,1,-0.15,0.6,-0.02,1,0.45,0.2,-0.02,1,0.435,0.22,-0.02,1,0.42,0.24,-0.02,1,0.405,0.26,-0.02,1,0.39,0.28,-0.02,1,0.375,0.3,-0.02,1,0.36,0.32,-0.02,1,0.345,0.34,-0.02,1,0.33,0.36,-0.02,1,0.315,0.38,-0.02,1,0.3,0.4,-0.02,1,0.285,0.42,-0.02,1,0.27,0.44,-0.02,1,0.255,0.46,-0.02,1,0.24,0.48,-0.02,1,0.225,0.5,-0.02,1,0.21,0.52,-0.02,1,0.195,0.54,-0.02,1,0.18,0.56,-0.02,1,0.165,0.58,-0.02,1,0.15,0.6,-0.02,1,-0.5,0,0,1,0.5,0,0,1,-0.7,0.45,0,1,0.7,0.45,0,1,-0.8,0.9,0,1,0.8,0.9,0,1,-0.85,0.95,0,1,0.85,0.95,0,1,-0.78,0.92,0,1,0.78,0.92,0,1,-0.75,0.88,0,1,0.75,0.88,0,1,-0.4,1.4,0,1,0.4,1.4,0,1]
    },
    {
      "sequence": 4,
      "timestampMs": 160,
      "features": [-0.45,0.2,-0.02,1,-0.435,0.22,-0.02,1,-0.42,0.24,-0.02,1,-0.405,0.26,-0.02,1,-0.39,0.28,-0.02,1,-0.375,0.3,-0.02,1,-0.36,0.32,-0.02,1,-0.345,0.34,-0.02,1,-0.33,0.36,-0.02,1,-0.315,0.38,-0.02,1,-0.3,0.4,-0.02,1,-0.285,0.42,-0.02,1,-0.27,0.44,-0.02,1,-0.255,0.46,-0.02,1,-0.24,0.48,-0.02,1,-0.225,0.5,-0.02,1,-0.21,0.52,-0.02,1,-0.195,0.54,-0.02,1,-0.18,0.56,-0.02,1,-0.165,0.58,-0.02,1,-0.15,0.6,-0.02,1,0.45,0.2,-0.02,1,0.435,0.22,-0.02,1,0.42,0.24,-0.02,1,0.405,0.26,-0.02,1,0.39,0.28,-0.02,1,0.375,0.3,-0.02,1,0.36,0.32,-0.02,1,0.345,0.34,-0.02,1,0.33,0.36,-0.02,1,0.315,0.38,-0.02,1,0.3,0.4,-0.02,1,0.285,0.42,-0.02,1,0.27,0.44,-0.02,1,0.255,0.46,-0.02,1,0.24,0.48,-0.02,1,0.225,0.5,-0.02,1,0.21,0.52,-0.02,1,0.195,0.54,-0.02,1,0.18,0.56,-0.02,1,0.165,0.58,-0.02,1,0.15,0.6,-0.02,1,-0.5,0,0,1,0.5,0,0,1,-0.7,0.45,0,1,0.7,0.45,0,1,-0.8,0.9,0,1,0.8,0.9,0,1,-0.85,0.95,0,1,0.85,0.95,0,1,-0.78,0.92,0,1,0.78,0.92,0,1,-0.75,0.88,0,1,0.75,0.88,0,1,-0.4,1.4,0,1,0.4,1.4,0,1]
    }
  ]
}
